rating,text,title
1,"Very disappointed that my Kindle Voyage, purchased in April, failed after just two uses. Went to charge it tonight to take on a business trip and it won't charge, won't reset, etc. Since my Best Buy receipt says I only have 15 days to return it, tried calling Amazon support. Their only solution after over 30 minutes on the phone is to process a replacement which may be a new or may be a refurbished device-- unacceptable to replace a less than 2-month old device with a refurbished one... but, given the poor experience I've had with the Voyage, I'm not even comfortable with a 'new' replacement at this point. Amazon says they can't do anything about a refund because I purchased from Best Buy-- 15 days seems a little extreme in a situation like this with a defective product!Stuck with a $200 paperweight :-(",Device failed after two uses
1,"My Kindle Voyage is nearly 16 months old and worked perfectly. I kept receiving emails from Amazon about the software update. I switched off airplane mode, switched on wifi and shortly after the screen locked up. I have tried everything with customer support and they now tell me I will have to buy a new one. I am very annoyed. If I had left the software as it was my Kindle Voyage would still be working.",Amazon Voyage dead trying to update software
1,very good produ ct and service will defintely refer to a freind.,very good produ ct and service
,"My previous kindle was a DX, this is my second kindle in years. Love the form factor and all but I do miss the physical buttons for page turning. There is a glitch in the software though. I use the English interface but occasionally I would like to translate words into traditional Chinese. However, it seems that the traditional Chinese characters cannot display correctly and become small boxes. The simplified Chinese characters can be displayed correctly though.",Great device for reading. 8 people found this helpful. Was this review helpful to you Yes No
,"Just got mine right now. Looks the same as the previous generation except for the Kindle logo (it's black this time), feels a little heavier, the screen is a little warmer toned than the previous one, BUT the resolution is SO MUCH BETTER! The 300 ppi are definitely obvious and the new font is worth the money.Totally recommend it for a book lover!I'll give it 4 stars instead of 5 because I am used to a cooler screen, but I'm sure I'll get used to this one soon too :)",Definitely better than the previous generation 16 people found this helpful. Was this review helpful to you Yes No
,"As reviewed by the wife This is the perfect thing for a new mommy who loves to read books! As soon as I had my baby girl, I had to stop reading my novels because I had to give the baby my full attention. But how much time do I spend laying in bed, on my side, with the baby while she feeds Especially prior to 4 months when feeding took as long as 45 minutes! Not to mention cluster feeds during growth spurts! A book was out of the question because it's sooo tiring to hold up in side-lying-breastfeeding-position. My new Kindle was the solution! It's light, easy to disinfect (I use baby wipes on the case whenever I feel like it's not clean enough to go on the bed with the baby) and you don't need to keep a finger in the middle of the pages to keep it from closing - you know what I mean!And for some reason it's much easier to go through a book with a Kindle compared to an actual book. I never thought I'd be converted into the Kindle culture but here we are!",Give this to a book-loving-new-mommy-who-breastfeeds 34 people found this helpful. Was this review helpful to you Yes No
,"My new Kindle Paperwhite came from the USA to a small town in Sweden in just five days. Payment of tax and customs handled by Amazon. Had not the UPS been so square (they think everyone sits at home all day) I had received it a day earlier.I am very pleased with the e-reader, easy on the eyes, and comfortable to hold in one hand. Even if I buy many books from Amazon I also want to read books in the ePub format. A positive surprise was how easy it is to convert ePub format to Amazon's own format. I use the program Calibre and then I just send the book as an attachment in an e-mail to my Kindle. Quick and easy!","Trouble-free international shipping, and easy to convert ePub 9 people found this helpful. Was this review helpful to you Yes No"
1,Slow response. Wait 5 sec to turn a page. Frustrating. Best Buy says too bad so sad for me.,Waste of money
1,"I have never had so many issues with a kindle and I have purchased alot. It's slow. It shuts off whenever it wants, the sd card dosent read half the time. And when it does it seems to be downloading it. And it deleted apps off my other kids kindle or adds when I do ... very very stupid . It has cracked . And I have never dropped it . It isn't made well. I am going to return it and I will probably never buy another kindle . HORRIBLE",Disappointed
1,"Found this tablet to be very intrusive with adds, almost forced to use credit card to make things work.",No freedom here
1,"Stay away from the certified refurbished Amazon Fire TV. I received two Certified Refurbished defective fire TVs. The first the screen looked half corrupted, see the pictures. The second Certified Refurbished Amazon fire tv I received would not boot up, it was stuck in an infinite loop where I would only see the amazon logo for 10 seconds then it would boot up again.If anything, Amazon needs to re-visit its refurbishment process and quality control of the refurbished products they let get in consumer hands.Update 11/28/16: I purchased a new Fire TV during the BF sale and I have had no issues so far :).","Purchase a new one, stay away from the refurbished fire tv."
1,"I bought this thinking since we'd bought several other refurbished things that worked, that it would be okay. The box never booted properly so the only thing we could stare at was the Amazon logo and the words Unknown Boot in the corner. Customer Service tried to help with the box but we couldn't get it to trouble shoot. Sending this box back.",Never booted
1,"Certified garbage! Lesson learned about paying attention to reviews. Fire TV box and remote was packaged like new, even included new batteries. After plugging it in it would only show Amazon logo and 'unknown boot' on screen. Cycled power several times and even tried to reset using remote buttons, no dice. I read all the negative reviews before I purchased this, I chose to take the chance so I'm angry with myself, but very disappointed with Amazon for even suggesting this is refurbished, let alone certified, as if that means something.",Certified Garbage!
1,"Hopefully, this will at least work as an e-reader. Otherwise, Amazon has it locked up so tight one cannot do much else with it. And, even with my fiber optic Wi-Fi it is slower than cold molasses in January in Canada. Well, I needed a Kindle e-reader and for $40 that is ok.",Good Price But That is Alll
1,This item is no good... will only last for 3 months & amazon basically tells you to f*** off,Will only last for 3months
1,Bought two of them first one would not charge after the first day. The second one The screen went blank so I have to return it now only after a couple of days of use. Will not purchase any more of this kind.,Don't buy
1,"charging port fault appeared in tablet after 2 weeks of purchase from BB, I went to BB store for warranty claim, they said to contact Amazon for any issue, Amazon said they didn't recognise my order in their system. Ended without any remedy.",NO WARRANTY COVERAGE
1,We got this for our son. He is always wanting to play on Mom's tablet so we thought this would be a good choice. His aunt does a lot of tech shopping and bought this same one for his sister so we got the same one. Within a month the charging cord on both units quit working and shortly after that the ports became squirly so you have to hold them just right or they don't charge. Save your money and get a more expensive but better quality product.,Not what we should have bought
1,"I have bought 2 tablets for my son and didn't open it after I received it because it was a birthday gift for them and when they open it on their Big day 1 of the tablet didn't turn on ,the screen is just purple I m out of country right now and will be back on August 4,2107 and I emailed BEST BUY ""Geek Squad "" and told them the whole situation but nobody responded,very disappointed it was a surprise gift for my kiddos and 1 of my son was really upset that tablet won't turn on,let's see if Best Buy read my review and take some action !!!","Tablet doesn't ""TURN ON""!!!"
1,This is useless. I have tried to calibrate it to my smart home. Pointless.,Pointless
1,I'm returning it because a new version is coming i,I'm returning it because a new version is coming i
1,You need gooooood wifi for this. If the wifi isn't good like it's in and out this will not work that good. You also need the app to set up alexa. I would only recommend this if you have great wifi,Amazon echo black
1,"Device does not stay connected to wifi, always disconnecting. This makes product unusable for alarms and timers. When used to work with harmony, at times, does not turn on all devices. Over priced and overrated. Purchased Google Home, for the past week, it has not lost contact with wifi, and works perfectly with harmony hub. Difficult setup with echo, even with 5-6 times with echo support, they can't figure it out. Wish I could return, not too late.",Does not work properly
1,We love it (that's me & my wife) . My son & daughter-in law & 2 grand-girls all love it.,Excellent
1,"Found out after having had opened and tried programming this awesome alexa that basically nothing comes with it. It's a listening device in my home that won't do anything unless I pay more into Amazon. The fact that I synced my pandora account is pointless because I have to spell out what I want Alexa to play by saying, ""Alexa play 'X' station from my pandora play list."" How is the rest of my family suppose to know what to request when I am the only one who knows my pandora play list (and barely at that!) I have many complaints, and basically disappointed in my purchase. I was lead to believe this was the radio of the future. It is if I pay for the Amazon Music Unlimited monthly.",purchased without research unimpressed
1,This device plays on the fact that you must subscribe to their stuff or this is just a empty cylinder that tells you the weather and that's it. And even then there is a subscription required for everything. Google Home at least plays general music lists and a number of other key actions.,Subscribe or Nothing Works
1,"Unless you have fiber optic internet, don't buy this. If you have ATT Uverse it will mess up the TV, lower the speed of your internet, and play havoc with the phone.It has not worked yet since getting it, since I only have 25mgb of internet, and it really does not work at that speed at all.",Works well only with fiber optic internet
1,Never knows answers to question or has the song I want. And always says not getting connection. It sucks,Terrible
1,Great Servive Best Buy and the price match is great I used it both at best buy,Good functioal product
1,The sound quality of the speaker in my opinion is not worth the extra cost versus a Echo Dot. I could spend the difference on a separate speaker to use with the Dot and also have the flexibility of using that speaker elsewhere.,Disappointing
1,This product not good waste of money I would recommend it,Not good
1,Alexa answers maybe 1 out of 10 questions we ask her - she uses Bing.com and it is really bad. Her standard answer is - I don't know the answer to this question. We ask her easy questions about stats or people. We also have a Google home and it answers almost every question right.,does not perform like advertised
1,"Not as easy as it sounded like it was going to be. So many things to buy to get full use out of what we knew we COULD do. Every question we seem to ask Alexa/she says she doesn't know the answer and that we'd have to ""download the app"" - so we never use her/only to ask her to set a timer and tell us the time and ask her to play music, which we also had to set up first. Not as neat as we thought she was going to be.",Not what we expected
2,Didn't have some of the features I was looking for. Returned it the next day. May be good for others,Wasn't for me
2,Not a good product short battery life i can only use for 20 minutes,short life
2,"If you shop on Amazon all the time, this will help make it easier still. Lots of ads pop up, and you can't use apps from non-Amazon sources unless you root it, and that is complicated. This is not a realistic alternative to an iPad or Galaxy Note. If you just want to a device to shop on Amazon with, you'll love it.",It is a shopping device
2,fire tablet is very powerful for the size and does everything!,great little device
2,"I have always gone to buy a kindle because I like the books and th games available. But I found them very unpredictable and unreliable. The color burns futon screen, then the screens starts jumping. As a result I have purchased 8 over the years. Not sure if Want to go through that for the 9th time!",Disappointed
2,My wife wanted an iPad. I bought her this because it was cheaper and good for reading and playing games. She uses iOS products so it's not compatible. She hardly ever uses it. Next time I'll get what she wants and not waste my money.,Not What She Wanted
2,"We purchased this as a replacement for our now-broken iPad. Though we liked the smaller size (more convenient, easier to carry, etc), the internet was sooooooo slowwwwww that it drove us crazy. Sometimes minutes to download a site (and this with no other apps open!1). Plan to go back to another iPad.",Returned it.. SLOW!!!
2,"Had it for about a week and now it won't take charge, tried new chargers and still not taking charge. Happy with tablet but unhappy about not chatging","Tablet nice, not so nice battery though"
2,This tablet could be so much better if the apps actually worked decently. The built in Amazon pieces for Prime members is great and work flawlessly. But it's not enough to overcome the terrible app behavior and countless freezes.  They need to take a lesson or two from Apple.,Just ok
2,Will not seem to charge all the way and this is my 7th Kindlle.,Not charging well
2,"If you need a basic tablet then the fire works. It falls apart when compared to the iPad mini from a usability, functionality and available apps standpoint.",Amazon Fire
2,The first Fire HD8 we purchased died within 1 week of purchase. We had to go back and exchange it for a new one. Not a good sign so far.,the first Fire HD8 we purchased died
2,I really liked the build quality but the very lackluster performance and minuscule battery life didn't make it a keeper for me.,Has potential.
2,"I got a magenta color because I loved the beautiful purple-ish color shown on the picture. Instead I got a really bright pink-ish color which looks nothing like the color shown here. I went to the store hoping to replace it with a different color but was told that since I bought it on sale, I had to pay the $30 dollar price difference if I wanted to exchange. Unbelievable. The product is good but I never liked the Best buy customer service.",Color difference is HUGE. Bad customer service.
2,"I bought this tablet as a replacement for my wife's Fire TV HDX 8.9 as her battery life is starting to decrease as it is getting older. Unfortunately, she was not happy with it as the tablet is slightly smaller screen wise (the next step is 10"" which is way too big, and has 4 less hours of battery life) and I was disappointed despite it being a newer tablet it was not able to decode HEVC, like the Fire TV 2015 boxes we have connected to our televisions. This unfortunately is a show stopper, as we can't view the movie library we have on this tablet. We will wait until a newer version comes out that is improved.",Disappointed
2,"Bought it in order to watch NBC but the NBC app isn't compatible, so now I have a paperweight.",Disappointed
2,Tablet had trouble from the begging it kept restarting and rebooting I had to return it.,Amazon tablet
2,The wifi would drop often to where I could not listen to Spotify or other services without buffering.,Weak wifi
2,"I think I downloaded 6 new apps. I wait to surf the web. This thing is so slow to respond. My old refurbished iPad is better. I really only bought it to stream Hulu and Netflix. I'm not excited about lighting up the home screen to find advertisements every day, but I guess you get what you pay for. I wanted inexpensive, I got it! Don't buy this if you are used to using quick responding electronics.",Too slow for browsing
2,I'm used to a n iPad so I wasnt impressed with the kindle. I found it hard to navigate,Ok tablet
2,"I loved this tablet. I did! BUT I did not love that I was being sold ads every time I powered up! I loathe even more that I would have had to pay $15 to discontinue that feature. Amazon if you want $105 dollars for the Kindle Fire, charge it! but don't under price the device, and then flash ads at the the consumer at every opportunity. It is unbecoming of you! I returned this item pronto!","This tablet was nice, but..."
2,"I was initially excited to get the Kindle. I am extremely disappointed with all the ads. Even more disappointed to find out that I could pay Amazon more money to remove the ads. It's frustrating that Best Buy and more specifically Amazon, don't let the consumer know on the box or in store advertising that what you're buying is a mini advertising billboard. Why couldn't there be an upfront statement on the box or in the store stating that the ""low price"" is subsidized by all the ads on the device? Would this have changed my purchase? Absolutely!!!! I would have spent a couple bucks more and probably got a Samsung tablet.","Disappointed with device, Mfg, and seller"
2,"The headphone jack restarts the tablet when you plug the headphone cord into it. That is why I am giving the product only 2 stars. Otherwise, the screen is great.",FireHD 8
2,"If you are looking for an inexpensive tablet just for basic web surfing/shopping/etc., I don't know that you can get a better deal. However, that is about all you can do. We found out the hard way that the Fire (which we bought to replace a misplaced iPad, so maybe we were just spoiled) is pretty limited in terms of the Apps you can download. Forget about any Google based Apps and many of the standard apps that are generally available in the Android or Apple market place. I love Amazon itself and don't have any major issues with the product I got for the price I paid, I just won't be going the cheap route in the future. Hindsight being 20/20, I should have spent the money to just get a new iPad since that is what we were used to.",Does the job most of the time
2,"nice size, very clear but randomly shuts off. cant remove unwanted apps from the home screen. if you watch video..it buffers alot and laggs.",great size
2,"My Hulu plays perfectly..great volume. Kindle starts right up so I'm able to read fine. However, when I'm on Facebook and click on an article to read, it goes to the page, and within 30 seconds, the page closes. Sometimes Facebook app won't even load. I find it blanking in and out and not showing some icons at times. I haven't dropped it so I'm assuming this is an internal problem :( I have tried playing a couple games and it will say that I need ""the Amazon app"" where I go to purchase stuff, which I already have...then it closes out saying ERROR. I wish I could replace for a new one.","Watching videos, great..then.."
2,"You get what you pay for... This is not great, the functionality and limitations leave much to be desired. Should have spent more and got another Samsung Galaxy Tab.",Very basic and cheap tablet
2,I'm planning on returning this tablet just as soon as I can!`,My tablet won't hold a charge
2,Easy to carry in purse or pocket but doesn't do anything better than the cheapest Kindle reader.,Very compact & light weight
,"The Kindle is my first e-ink reader. I own an iPad, an iPhone, and have owned a Windows-based phone in the past that I used as an ereader.My overall impression of the device is good.The good:I'd honestly rather read linear (read from page one to the end, one page at a time) fiction from it than a book, because I can't always get comfortable with a book. Hardcovers are sometimes a bit heavy, and paperbacks don't always lie open easily. The Kindle is incredibly light and thin. I can hold it in one hand easily. The page turn buttons are conveniently located. Page-turns aren't instant, but they're probably quicker than turning a physical page in a printed book (there are just a lot more page-turns unless you choose a small font). The contrast is better than other ereaders I've seen. There is zero eye strain in good light. My eyesight isn't the greatest and I like being able to increase the font size and read without glasses. I love being able to browse the Kindle store and read samples before deciding to purchase. The experimental browser is surprisingly usable, but isn't great. It is useful for browsing wikipedia and blogs. The biggest drawback to the browser is the awkward pointer navigation, using the 5-way pad. It syncs your furthest read page over the internet so you can pick up where you left off using your iPhone or iPad.The so-so:The kindle store could use more categories and sorting options. You can't sort by top rated, and there is no category for alternate histories, for example. Finding a very-specific type of fiction relies on keyword searches, which don't do a great job. The wifi sometimes doesn't connect before it times-out.Read more","Worth the money. Not perfect, but very very good for start to finish novels in good light"
,"I'm a first-time Kindle owner, so I have nothing to compare the latest Kindle to. I don't own a Nook. I don't own an iPad (and, in any case, that's comparing apples to oranges). I don't have a Sony e-reader. 'This will be a short, simple review.I received my Kindle about a week ago and haven't been able to put it down.Things I like about my Kindle1. The e-ink display is amazing.2. Using the 5-way controller is simple and effective.3. Page turn speeds are faster than I thought they would be.4. It's lightweight, even with the attached cover (I have an Amazon cover with a built-in light)5. Page-turning buttons are quiet and well-placed.6. Recharge time is fast.7. I can order a book and start reading it in less than 60 seconds. Nice!8. Portability... I can take 3,000 books with me when I travel for work and not require additional suitcases or baggage fees.Things I'm not too keen on1. Buttons are too close together and are laid out oddly.2. Lack of individual number buttons is frustrating.3. Power button on the bottom Not a bad thing. Just an odd thing. (Same for the headphone input). I usually rest the bottom of a book on my lap when I read.Things I hope change in the future1. How books are organized... When I put a book in a collection (which is actually a tag), it still appears in the main list. It's not actually moved, it's merely associated.2. The look of the main screen. I'd like folders or some other way to display collections.3. Ability to create personal screen savers.4. E-book pricing, though Amazon has little control over this.Read more","I Wanted a Dedicated E-Reader, and That's What I Got"
,"UPDATE NOVEMBER 2011:My review is now over a year old, as is the Kindle Keyboard as Amazon calls it now. There are newer models: the basic, cheapie Kindle and the Kindle Touch, and of course the Kindle Fire quasi-tablet.Each of these models is an excellent choice. Whichever one is right for you just depends on your preferences.The 3 e-ink Kindles are Kindle Keyboard (this one), Kindle Touch (the newest flagship model), and the basic Kindle. All 3 of them have EXACTLY THE SAME 6 DISPLAY, with the same sharp typeface and high contrast that reads like ink on paper with no eyestrain. The Kindle Keyboard is the oldest of these models, and I got one of the first ones when they came out in August 2010.I still absolutely LOVE my Kindle Keyboard and use it almost every day. I have read dozens of books on it. I like the newer models, they have some neat features, but the experience of reading a book on them is no better or worse than on my 1-year-old Kindle Keyboard. Page turns are now smoother and faster on the newest Kindles, but the difference is not enough to make it worth the cost of upgrading, in my opinion.The touch-screen interface of the Kindle Touch is pretty neat. But, unlike my iPad, I only use my Kindle to read books, and reading books is just as nice on any of the current Kindle models. I don't consider the touch screen a must have feature, and I'm normally obsessed with having the latest version of every tech product I own.For that reason, I think the cheapest Kindle is an excellent choice.Read more",Kindle vs. Nook (updated)
