rating,text,title
2,Amazon fire is a good tablet if you like e-books. It's also nice to get a six-month subscription to the Washington Post. Their claim to have 16 gigabytes of storage is misleading because it only gives you 5 and then they want to charge you the same amount of money that you paid for the tablet for unlimited storage.  Another problem is that you can't flag something as being inappropriate like you can on Samsung Galaxy tablets.,Okay tablet
2,"I don't want to get too negative on this, because it does what it's supposed to. However, I'm not sure how Amazon justifies charging 40! Half that and I'd feel a lot less disappointed. It's nothing like the last generation cover, which was hefty and substantial. That thing could take a beating! This one Umm...not so much.PROS:- I really like the solution Amazon came up with to lock the Kindle in place sort of a rubberized cup that grips it on all four sides and holds it VERY securely. No more metal-prong slide-release gizmo.- It looks quite nice and is genuine (if untextured) leather like the last one.CONS:- Flimsy. The leather is extremely thin and unpadded. Won't stand up to much abuse. scrape it even lightly on a rough surface and you'll likely ruin it.- The actual cover that folds over the front is incredibly floppy and delicate -- it's about the thickness of a piece of notepad cardboard. I could bend it in half with almost no effort, if I had the notion.- Cover has no lock/closure mechanism (like the elastic strap on the last gen model). It should have SOMETHING.Oh, well. It is what it is. I never read with the Kindle in the case anyway so it's not such a big deal to me, but I was expecting more. Especially for this price!","Does the job, but way overpriced"
2,"This is a good tablet for children and adults too. However there is an issue with the port and charger cable. We did not even have this tablet 3 weeks before it would barley charge. Took it back to best buy and they said they could not fox it, and imagine the port is not covered under the manufacturer warranty. So now I have a tablet that takes a couple days to charge. Its really frustrating.",Nice but problematic
2,The charging plugs on these kindle damage way to easy. I am very disappointed as this is not the first time this has happened to one of my kindles.,Charging plug
2,"So I bought my little guys these tablets... so that I could repossess my IPad. Love the free time app but who could've imagined they wouldn't play NETFLIX!! So now... I'm out the money for the tablet and still don't have my iPad back... and yes, I called Amazon numerous times... they work after the fix, but the next time they go to use them they don't work again... the fix takes several minutes as it's force stopping the app, clearing cache then doing a hard restart... then you have to wait to restart Netflix.... oh and sometimes you have to do it numerous times before it works... if it works at all",Disappointed doesn't play Netflix
2,"So I bought my little guys these tablets... so that I could repossess my IPad. Love the free time app but who could've imagined they wouldn't play NETFLIX!! So now... I'm out the money for the tablet and still don't have my iPad back... and yes, I called Amazon numerous times... they work after the fix, but the next time they go to use them they don't work again... the fix takes several minutes as it's force stopping the app, clearing cache then doing a hard restart... then you have to wait to restart Netflix.... oh and sometimes you have to do it numerous times before it works... if it works at all...",So disappointed doesn't play Netflix
2,"Seemed to be fine as Chtistmas gift for granddaughter. However, today she reported that it wouldn't turn on or charge today. Supposed to have two year unconditional guarantee. Don't know where to take it.",kids' kindle fire
2,"I have to say this was not that great a purchase and we will most likely be taking advantage of it's greatest product feature, which is the ability to return it for a full refund. We wanted a smaller tablet for our kids, well this is smaller in every way, options are limited and we have realized that we are better off just letting the kids use our tablet so we can buy the newest one. This thing may go back to the store as soon as tonight.","I expected limitations, I got limitations"
2,I bought this tablet for my son and I don't like it. The touch screen is very poor quality. It's hard to move things around on it when he is playing a game. He prefers my iPad than to use his own. I know the iPad quality is probably the best quality but it's way under that! Very frustrating. Will be returning it.,POOR QUALITY
2,"Not sure why, but it kept freezing and ended up having to return it. Very disappointing",Kept freezing
2,"I am disappointed that this is not more toddler friendly. It is a kindle inside a kid proof case. You have to set up child locks, etc. My biggest complaint is most of the games that are available you have to be connected to the internet. I wanted something to take to church, in the car, etc.",It's ok
2,Picture quality is not good. I don't like this product,Not good
2,"You can not block Bing and it shows ""trending now"" News content. This can not be deleted or blocked. It also types ahead and adds content.",Internet Issues
2,Touch response is not so good. so my kid refused to play games on this.Returned this product. Thanks to Bestbuy for the full refund,Touch response is not good
2,"I bought 2 Amazon Kid's Fire Tablets for my two grandsons for Christmas. Included in the purchase of the A.K.F. Tablets is a one year subscription to KID's Free Time.I have called & emailed inquiring about the registration process in order for my daughter to activate & begin using the free one year subscription of KID's FREE TIME, & still no resolution.Upon trying to register tablets, credit card used to purchase is required. I do not understand why my credit card needs to be submitted in order to obtain/activate a service that is included in the already PREPAID Purchase!I have been waiting for a response since Christmas.Therefore, at this time, I would have to give a 2 star rating due to the lack of customer service available for this product. With hope of getting this issue resolved I would still recommend to a friend.",AMAZON KID's FIRE TABLETS
2,"Was looking for a tablet for my young daughter. This was on sale and had good reviews. After consulting with the sales associate with some questions, I decided to purchase item. Nice looking product, however, very little storage space.... after downloading a few apps... the storage was full and was required to buy more! Also, cannot play videos unless hooked up to wifi. Unlike the sales associate told me. Very disappointing!!! Would not recommend!",Disappointing product.
2,Slow processor equates to slow internet browsing. User I nterface is ok. Really wish it had the capability to lock onto the movie screen while my toddler watches movies. Next time I'll just spend the additional money on an iPad mini for my kids.,Just ok...
2,When i purchased 2 if them i assumwd it would be kid friendly. Its fill with tons of bloat wear. The opening screen has about 15 -20 apps. It worse than a normal adult tablet. my kids dont use it at all because we have to unlock it for them everytime then open the kids app. Then we have to hover over them to help them ever step of the way.,not kid friendly
2,"I received an email asking if I would like to give my review and I am glad that I did. I purchased this less than 2 months ago and it has already quit working. It will not charge and it will no longer power on. All I have is a black screen. When it did work, it dropped internet quite frequently and froze several times during use. I would not recommend this product.",Very disappointed
2,Hard time getting the free apps to load and the voice app to turn off when my seven year old accedently turned it on.,Hard to set up
2,The tablet itself works fine but this is the 2nd one I have gotten with a similar problem. The port seems to come defected. The charger doesn't stay in and it takes a long time to charge. Replaced charger with a brand new one and it still has issues.,Not as happy as I thought
2,"Got this for my 8yo daughter. A lot of the times it doesn't work, I have to restart it a lot, and it only has 3 apps that I added on it. It came with way too many pre-loaded apps, and the most annoying thing is that the kids profile is permanently horizontal. Not really worth the money for me, but at least she's playing her Inside Out bubble game on her own tablet instead of my IPad.",Okay
2,"Downloaded movies for my son to watch and the audio is terrible, you could barely hear it so I returned it",Didn't like it
2,Prob good for price but to many bugs. Freezes up often and games don't always load,Not great tablet
2,"this item is not good ok ...no use for my kids ,,,",not good
2,It was too slow he didn't put any attention to it. Battery didn't last.,My son didn't like it
2,"After owning the kids Samsung, this seems confusing to navigate. Also they have returned to using the Samaumg",so so
2,"I bought this Kindle for my 7 year old grand-daughter. I bought a warranty for it. I bought it in August, I have already had to replace it. The charger connection got loose and was not charging. Well, it has happened again. I will need to exchange it again. The problem is that I have to buy the warranty each time. I was going to buy one for her brothers and sister, but I am now rethinking that.",Kid's Kindle
2,"Super slow, not of decent quality.I would not buy another. Memory on it is lacking for 8 gig. I will not recommend it to anyone",Not good
2,"My 5 year old dropped this from a standing position (about a foot off the ground) and it busted. I had to use the BB warranty to replace it the day after purchase for a fall that the tablet should've been able to handle that is designed for kids. I'm happy with the apps, but definitely not thrilled with the lack of protection that is designed for kids.",Eh
2,I didn't find it useful for my 4yr old daugter so i returned it the other day.All the games in it r so kiddy games.,Not much useful
2,Very difficult to connect to You Tube. Very frustrating,Okay.
2,Bought it for my 5 yr old daughter and for some reason it did not work. This is the second time I've purchased this and had to return it. So I will get her a mini iPad. Never again will I waste my time and money.,Horrible Item
2,Got this for my 9 year old and several games that he wants to play are not accessible on this tablet. Seems like this is geared more towards younger kids. Case is good though and keeps tablet safe. Would be tough to break!!,Maybe better for younger kids
2,"Maybe I had higher expectationin general i will not recommend since the service of Amazon solving situations is not as good as in other products, I've had so much troubles with the amazon free time, I am even not longer using it (it was one of the ""big"" features on the advertisment. I will recommend to look for other alternatives before to take a decision on buying this product",Regular Tablet
2,"When this item is charged it works great, but it takes too long to charge. Asking my 3 year old to wait about 3 hours (no exaggerating) is a bit much. We have tried to buy a new charger and it still takes just as long. My niece has this same tablet and it take about 45 minutes to charge once it is fully dead","Great Tablet, but it takes over 3 hours to charge"
2,"Reading a book, it's great. Working with PDF files, not so great. Also please be aware that Amazon Customer Service will treat you like a pariah because you purchased this Kindle from Best Buy instead of directly through their store.",Good with issues
2,Tried to use it for and it's does not work as ebookWhich is why I am not satisfied ..,Not satisfied
2,Not a big reader but gave it to someone that is. She is happy so I think that should make me happy.time will tell,Good for reading
2,"I wanted to like this a lot because my Ipad Mini is ""heavy"" to carry in my purse all the time. This is so very light. BUT they make you jump through hoops to get rid of all the advertising on the device AND when you buy it at Best Buy you are not given a choice to ""spend an extra 20 on a 119 dollar ""book"" or put up with their ads"". I had to go through being on hold FOREVER to get someone to help get this off my device so that was an IMMEDIATE turn-off. I don't find it to page-turn handle as well as my OLD ORIGINAL NOOK OR NOOK COLOR and certainly not anything like the Ipad Mini. If I hadnt kept it too long to return I would have. It doesn't auto correct to landscape then portrate, nope you have to MANUALLY CHOOSE ONE OR THE OTHER AND GOING BACK AND FORTH IS just stupid...it should have been part of the IMPROVED design, THEY REALLY MISSED THE MARK FOR THE PRICE. i CAN GET A FULL TABLET FOR LESS MONEY THAT DOES ALL THAT AND SIMPLY USE THE KINDLE APPPROSLight weightSmall for purseback lightCONS1-comes preloaded with ads2-not easy to get them off if you buy device in a store3-page control is not that simple4-t doesn't auto turn from landscape to portrate you have to set it to one OR the other5-not as touch responsive to anything6-don't like the organization of it",TOO MUCH BAGGAGE TO GO THROUGH
2,Very nice eReader - a big step up from the basic reader that I started with.,Nice and light
2,It does what it is supposed to do. I wanted access to the internet to download books and didn't realize it would not do this feature. I would onIy recommend if a person only wants to read books from Amazon.,Didn't read reviews
2,It's more for people that want to read without glare,Kindle
2,"The paperwhite was excellent at first but just yesterday (Feb. 22), less than 2 months since I purchased it, it froze and nothing I do will work. I am taking it back to Best Buy and hope they can fix it.",Not happy with it at this time.
2,"This edition does not have backlighting which is a big deal!!! If you like reading in bed or indoors without needing to use external lighting, you should not get this version! Get one of the newer editions! If you only read in well lit areas, then go for this one! Kindle is fantastic and I love my white lightweight long lasting kindle with the option to use background light.",The paper white is outdated.
2,No access to the Internet.........Won't recommend!,Kindle Paperwhite
2,"The earlier models were so simple to use. No nonsense listing of books in it's library, by author or title. Now there are big pictures with tiny lettering and lots of ads.",It is not user friendly
2,"Too small for me. Page turning constantly due to size. Page refresh jumpy, irritating to my eyes.",Overall unsatisfactory
2,"I am on my 3rd Kindle. This software downloads new purchases with a picture of the cover of the book on my homepage. Only about a fifth of the available space. So this would only allow you to buy at most four books at a time before the covers would be too small. The new books should be downloaded to my Library in List Form as in the original Kindle. In addition, once you have looked at a book in the homepage, it disappears and you have to search for it or place it in a category. Finally, this system disallows you from manipulating books the way you want. This OS is definitely NOT USER FRIENDLY. It requires a great deal of effort of the user. A lot of wasted data space and waste of time. I am requesting a return to the original Kindle OS.",Original Kindle OS was the best.
2,I bought it for college textbooks but took it back because it didn't work for this particular device.,Didn't do textbooks!
2,"While reading might be a bit easier on the Paperwhite, navigating on it drove me nuts. The touch screen is annoying and has limited functionality. I tried to like it. I just couldn't. It's sitting unused while I use a less expensive Fire.",Replaced with Kindle Fire
2,"Still adjusting...had kindle fire and liked the ease of touch for turning pages, definitions and location in book. Paper weight is Much more difficult to maneuver, doesn't seem to be as touch sensitive as the fire. I have to repeatedly touch screen to get page to turn and definition accessibility also takes more work. Also, bookmarking doesn't seem to stay on page.","ok, light weight but like old kindle fire better"
2,Don't buy this if u don't read books also very rarely read the book,If u r seriously a book lover
2,"It will not charge in USB on computer, have to take it in.",wont charge
2,very difficult to operate this if having problems knowing how to get to the instructions. Should have some computer knowledge prior to purchase.,needs better instructions
2,"The Voyage, when it worked, was great - the page turns make the reading experience seamless and the ink is crisp, making it a real upgrade from the Paperwhite. That said, it started to freeze up quickly after I got it. Hopefully this is a software issue that will be resolved soon (and the price of early adoption, sometimes), because overall, I couldn't be more pleased with the (working) Voyage.","Great at first, but glitched quickly."
2,"I accidentally cracked my screen on the first day when the Voyage was too close to my rocking chair and neither Best Buy nor Amazon would do anything to help. Well, Amazon offered $15 off purchasing the Paperwhite and that wasn't something I wanted at all. Now I'm stuck with a $199 broken Voyage. Not a happy customer. I realize it was my fault but thought they should do something more to minimize the loss and keep my business.",Be careful with your Voyage
2,i cant at night it has no back light from one to ten its a 7,cant reed at night
,"My previous kindle was a DX, this is my second kindle in years. Love the form factor and all but I do miss the physical buttons for page turning. There is a glitch in the software though. I use the English interface but occasionally I would like to translate words into traditional Chinese. However, it seems that the traditional Chinese characters cannot display correctly and become small boxes. The simplified Chinese characters can be displayed correctly though.",Great device for reading. 8 people found this helpful. Was this review helpful to you Yes No
,"Just got mine right now. Looks the same as the previous generation except for the Kindle logo (it's black this time), feels a little heavier, the screen is a little warmer toned than the previous one, BUT the resolution is SO MUCH BETTER! The 300 ppi are definitely obvious and the new font is worth the money.Totally recommend it for a book lover!I'll give it 4 stars instead of 5 because I am used to a cooler screen, but I'm sure I'll get used to this one soon too :)",Definitely better than the previous generation 16 people found this helpful. Was this review helpful to you Yes No
,"As reviewed by the wife This is the perfect thing for a new mommy who loves to read books! As soon as I had my baby girl, I had to stop reading my novels because I had to give the baby my full attention. But how much time do I spend laying in bed, on my side, with the baby while she feeds Especially prior to 4 months when feeding took as long as 45 minutes! Not to mention cluster feeds during growth spurts! A book was out of the question because it's sooo tiring to hold up in side-lying-breastfeeding-position. My new Kindle was the solution! It's light, easy to disinfect (I use baby wipes on the case whenever I feel like it's not clean enough to go on the bed with the baby) and you don't need to keep a finger in the middle of the pages to keep it from closing - you know what I mean!And for some reason it's much easier to go through a book with a Kindle compared to an actual book. I never thought I'd be converted into the Kindle culture but here we are!",Give this to a book-loving-new-mommy-who-breastfeeds 34 people found this helpful. Was this review helpful to you Yes No
,"My new Kindle Paperwhite came from the USA to a small town in Sweden in just five days. Payment of tax and customs handled by Amazon. Had not the UPS been so square (they think everyone sits at home all day) I had received it a day earlier.I am very pleased with the e-reader, easy on the eyes, and comfortable to hold in one hand. Even if I buy many books from Amazon I also want to read books in the ePub format. A positive surprise was how easy it is to convert ePub format to Amazon's own format. I use the program Calibre and then I just send the book as an attachment in an e-mail to my Kindle. Quick and easy!","Trouble-free international shipping, and easy to convert ePub 9 people found this helpful. Was this review helpful to you Yes No"
2,"Bought Amazon Fire TV 2/16/15, this is NOT the replacement cord for my model.Be aware of what you are purchasing --- this is NOT a fit for the older Fire models.Alternate, non Amazon, power cords are available for the older version of Fire TV on Amazon.",NOT for First Generation Fire TV One person found this helpful. Was this review helpful to you Yes No
2,This tablet could be so much better if the apps actually worked decently. The built in Amazon pieces for Prime members is great and work flawlessly. But it's not enough to overcome the terrible app behavior and countless freezes. They need to take a lesson or two from Apple.,Just ok
2,Still not able to connect to wifi so I am unable to give a recommendation.,Can't connect to wifi
2,It is ok but I like my bigger screen one but it broke in less than two years,It is small and you did not have bigger screen
2,The tablet periodically shuts off for no reason. I have contacted Amazon but their only suggestion was to reset to factory default.,An ok tablet
2,"Full disclosure, I've only had iPads in the past. I needed an android based tablet as a 3rd party app that I needed was yet IOS supported. You get what you pay for. Build quality, touch and feel, yes it's equal to the price. Constant adds urging you to make various Amazon based purchases...not my cup of tea but I guess fills a price point and need.",You get what you pay for...
2,I bought this thing refurbished. I find that I have to unplug / plug back in the HDMI cable on a regular basis when switching inputs on the TV. Not sure if it is the Amazon Fire box itself or if it is the TV (Not likely).Otherwise it is a good device. I bought it for the ability to hard wire my Ethernet connection to my gigabit switch and for 4K capabilities which it does do. Having the Alexa app is handy but her features can be severely handicapped.I probably should have just bought it new..... usually refurbished devices work well as they are tested before resale and it was probably tough to catch that the HDMI port on these might be finicky. I may have to switch it out.,Refurbished version is giving me problems with HDMI connector. Otherwise it's a good device. Careful with refurb!
2,"This Amazon Fire is fine for just reading and minimal research and investigative work. Apart from e-reading, it is slow and unresponsive.","A Reader, Yes -- A Tablet, No"
2,The thing broke within the first week. The charging port was bent and it wouldn't charge.,Junk
2,"This tablet conked out on me the first day I powered it on. The Amazon symbol came up and never went past that screen. I was highly annoyed because I purchased it as a first to send it out of the country. My biggest mistake was trusting that everything would work fine, instead I should've powered on the device to ensure everything was fine.",Room for improvement
2,"My kids use it for playing games only. Memory is too limited. If you want to expand memory you have to buy special memory card from Amazon. Regular cards won't work. I'll like the app free time to help protect the kids from what they watch and play but it is difficult and time consuming to get updates for the games they play. Amazon does not have the best user friendly software for their tablets. They do what we get it for, entertain the kids for awhile.",Don't like it much.
2,"I bought this to use only one application. Oh, is it most difficult to get this thing to continuously work! And I still can't get the geek squad program to properly download onto the device. I'm pretty disappointed.",Kindle not so cool
2,Poor response. Very sluggish. Even the Amazon app is slow. Not so on my Apple or Droid tablets. I've yet to load any apps.,Sluggish
2,"I had a Nook, but it died so I wanted a replacement, and bought this Fire tablet on black friday last year because it was very inexpensive, but as the old adage goes, you get what you pay for. It's OK for basic web surfing, but it's limited, slow, and has one little speaker on the back so if you lay it on a table you won't be able to hear it very well.","Basic, no frills tablet"
2,"No the best tabler, is loaded with bloatware from amazon.",Not the best tablet
2,"Bought this item with high expectations of its capabilities. It would be extremely lenghty to supply full details, let me just say that technology is not there yet with AI devices like this....",NOT THERE YET.....
2,I feel that Alexa does not know a lot of information. It gets very frustrating.,I feel that Alexa does not know a lot of informati
2,"Purchase the echo with my Vivint system because sales person pushed the product stating it would enhance the Vivint capabilities. Not really so...it's a nice gadget for music and putting together shopping lists and ""to-do"" lists, but not really something we needed. In addition, not enough apps that work with it.",Unnecessary Gadget
2,"Thought we'd have tons of fun with Alexa; found that had to stretch to use it productively. Maybe that's why Amazon puts out a steady stream of ""Here's what's new with Alexa"" emails, a lot of them revolving around buying more stuff from Amazon.",An answer in search of a question
