rating,text,title
1,"i Bought this around black friday for $60 hoping it would be awesome... it failed so hard i tried multiple different micro SD cards none of which were recognized and YES i formated them with every format i could think of ... Fat32, NTFS, Fat, Xfat... i even tried to have the tablet do it... didnt work... to make matters worse half the apps i wanted to use werent in the app store and i came to find out that it isnt linked to the normal google play store this tablet has its own app store which is missing many common apps... the main reason i bought this was to play clash of clans and i cant because it wasnt on the app store... i tried to also use aftermarket play stores to play COC but it didnt work... launched and played 1 time but didnt work or update after that... needless to say i returned it and bought a $250 samsung galaxy tab A 10.1 (2016 version) with S-pen and its WAYYYYY better... bottom line you get what you pay for... also hint the s-pen version has an extra 1 GB of ram over the non pen version... so you should get that if you can afford the extra $50...",TERRIBLE DONT BUY
1,I bought this tablet for my 4 year old daughter. Too many advertisements. I would rather pay more and not have a single ad.,Ended up returning
1,Didn't want to go to the sites amazon wanted me to.,returned item
1,"This Kindle is so overloaded with apps that I will never use. Despite what one of Best Buys' associates said, you cannot remove any of the Amazon apps. The apps take up too much of the memory. I have an I Pad and love but bought this as a backup for work. Unfortunately, it bogs down. I also don't like that Amazon wants access to too much info to set up email, so I won't use this for emails either. I will likely sell it on Craig's List for less than half of what I paid for it.",Too may preloaded useless apps
1,I liked it at first except the browser is kind of clunky. Also you can. It use all android Apps. The worst thing though was mine just stopped working in the middle of watching a movie on a long plane flight. It was fully charged. I have tried recharging and turning on etc. it is just a blank screen and off. Kind of a cool paperweight. Hope I can get my money back. Or get a new one.,Broke in 5 mos
1,"If ads dont bother you, then this may be a decent device. Purchased this for my kid and it was loaded down with so much spam, it kept loading it up making it slow and laggy. Plus the carrasoul loadout makes it hard to navigate for kids, not very kid friendly! Oh you can pay $15 to remove the ads but it wont remove them all. Buy the samsung, better everything!",Ads ads and ads
1,"not good, hate it , never buy it again, sucks. done",hate it
1,This is not a bad product. Amazon offers greats products but this tablet was missing features even for a basic tablet. The lack of google chrome compatibility made this tablet not right for me.,More ideal for a child or teen.
1,We bought this earlier on line from another vendor and it was never delivered. Best Buy was great.,product works real well.
1,Freeze frequently... No way to trouble shoot or repair it...,Very poor.
1,"I went with this tablet based on many good customer reviews, but my experience was not a good one. From the start I was on the phone every day for at least an hour with Amazon tech support for one issue or another. Most of the techs were very polite, but not all knew the product very well. At one point I asked one of them about trying to save some RAM and they kept referring me to the storage, which told me they didn't even know the difference between RAM and regular storage. The internet browser was basic and it ran very slow at times, even when all my other wifi devices ran great. Then a day would pass and I'd be trying to type an email and the keyboard would just stop working...wtf??? Come to find out it's a ""known issue"" and ""they're working on it"". After two weeks of one thing after another I got fed up and just returned it. I wanted it to work, and gave it a good run, but just not quality stuff. To me it was like Walmart trying to build their own computer when they're obviously not a computer manufacturer, neither is Amazon. If I were you I'd look at a regular Android tablet from a reputable PC manufacturer, which is exactly what I did next. I got an ASUS tablet for only a few dollars more, and it's unbelievable. 1000% better in comparison to the Amazon Fire HD8. Save yourself the aggravation and go with ASUS or some other company that is specifically in the computer business full time. Sorry Amazon, not this time!",NOT WORTH IT
1,This thing lasted not even a month before it went dead. Going to try and take it back,dead
1,"Worked great but after awhile I wouldn't unlock. After I'd enter my pin, the screen would go black. I took it to geek squad (luckily I bought the protection plan!) and told me they don't fix them they just replace them. So I got another one but that one did the exact same thing. Ended up returning that one too.",Won't unlock
1,I bought the kindle fire 8 for my husband and I to use. Neither one of us have been able to figure out how to use it. Every time we open it advertisements pop up. And we just try buttons to remove it. We cannot get it to rotate for our puzzles. Just too complicated to use and to navigate around. I will be returning it. We have an iPad and it's much easier.,Unable to use it
1,I am bring it back for an exchange. (a different make),"8"" fire 16gb tablet"
1,I brought this tablet during the Black Friday sale fast forward to Christmas when my 6 year opens it he was happy I set it up for him two days later it crashed never came back on. Blank screen. He was disappointed and so was I .,Poor quality tablet
1,horrible...just like the other 7 i have owned ONLY due to warranties,non functional!!!
1,Does not let me connect with my library. Very diapointed,App options pathetic
1,"I have only had this Amazon Fire Hd8 since December 6, 2016 and it has already quit charging.",Quit charging
1,"If adding more than one child to the account, the screen will not rotate properly for the second, third, or fourth child. Geek squad could not fix this problem, seems to be a manufacturer's issue. Also, there are too many adds. I returned this product.",Does not work well for multiple children
1,It was on a total of an hour and a half when the screen went completely dark. Would not turn on after that. The battery was fine....It just quit working all together.,1.5 hours
1,I bought this on line as a gift. The unit does not stay on and I cannot get in touch with anyone to get the unit repaired,Doesn't stay on
1,"Nothing but problems after a month. Luckily I could take it back and get a credit for the kindle to put towards an ipad. It started off working fine then after a month it started losing internet connection randomly (while the old ipad had no problems). Then it stopped charging, never got past 1%. Tried different outlets, different android chargers. Nothing. Worthless",horrible
1,"was cheap, can not run chrome stuff, returned to store.","was cheap, can not run chrome stuff, returned"
1,"I bought this to replace a 3-year old Kindle Fire 7"" HDX that I had just dropped on the floor. I sort of panicked, so after doing a couple of hours of research I picked this tablet. Just to be on the safe side I got 16 additional GB of memory. I installed a couple of games (none of them memory hogs) and a cookbook app, in addition to downloading a couple of books and dictionaries. I can honestly say this is the slowest tablet I've ever had. Just rotating the screen takes 7-10 seconds, and that's if there's only one app open. Opening a book or magazine can take half a minute, and God help you if you want to switch between a recipe and a magazine while you're cooking! Amazon is obviously more concerned about showing you constant special offers and apps than having satisfied customers. Since there are no other Fire tablets available for whatever reason (maybe they're being discontinued?) I'll be replacing it with either an iPad or a Galaxy tablet.",Couldn't possibly hate it more.
1,Prior to using the device I decided to recharge it to 100% and was shocked to find out that it takes 6 hours. Unless you have a lot of time don't buy this device.,Poor charging
1,This is not an upgrade by any means! My three year old kindle outperformed Oasis.Battery life better than a week with the lights on lowest setting Magnetic connector is poorly designed and grows weak Two pieces to keep up with; unsnaps constantly Amazon Customer Services promises it will resolved in an update,Horrible Battery Life
,"The Kindle is my first e-ink reader. I own an iPad, an iPhone, and have owned a Windows-based phone in the past that I used as an ereader.My overall impression of the device is good.The good:I'd honestly rather read linear (read from page one to the end, one page at a time) fiction from it than a book, because I can't always get comfortable with a book. Hardcovers are sometimes a bit heavy, and paperbacks don't always lie open easily. The Kindle is incredibly light and thin. I can hold it in one hand easily. The page turn buttons are conveniently located. Page-turns aren't instant, but they're probably quicker than turning a physical page in a printed book (there are just a lot more page-turns unless you choose a small font). The contrast is better than other ereaders I've seen. There is zero eye strain in good light. My eyesight isn't the greatest and I like being able to increase the font size and read without glasses. I love being able to browse the Kindle store and read samples before deciding to purchase. The experimental browser is surprisingly usable, but isn't great. It is useful for browsing wikipedia and blogs. The biggest drawback to the browser is the awkward pointer navigation, using the 5-way pad. It syncs your furthest read page over the internet so you can pick up where you left off using your iPhone or iPad.The so-so:The kindle store could use more categories and sorting options. You can't sort by top rated, and there is no category for alternate histories, for example. Finding a very-specific type of fiction relies on keyword searches, which don't do a great job. The wifi sometimes doesn't connect before it times-out.Read more","Worth the money. Not perfect, but very very good for start to finish novels in good light"
,"I'm a first-time Kindle owner, so I have nothing to compare the latest Kindle to. I don't own a Nook. I don't own an iPad (and, in any case, that's comparing apples to oranges). I don't have a Sony e-reader. 'This will be a short, simple review.I received my Kindle about a week ago and haven't been able to put it down.Things I like about my Kindle1. The e-ink display is amazing.2. Using the 5-way controller is simple and effective.3. Page turn speeds are faster than I thought they would be.4. It's lightweight, even with the attached cover (I have an Amazon cover with a built-in light)5. Page-turning buttons are quiet and well-placed.6. Recharge time is fast.7. I can order a book and start reading it in less than 60 seconds. Nice!8. Portability... I can take 3,000 books with me when I travel for work and not require additional suitcases or baggage fees.Things I'm not too keen on1. Buttons are too close together and are laid out oddly.2. Lack of individual number buttons is frustrating.3. Power button on the bottom Not a bad thing. Just an odd thing. (Same for the headphone input). I usually rest the bottom of a book on my lap when I read.Things I hope change in the future1. How books are organized... When I put a book in a collection (which is actually a tag), it still appears in the main list. It's not actually moved, it's merely associated.2. The look of the main screen. I'd like folders or some other way to display collections.3. Ability to create personal screen savers.4. E-book pricing, though Amazon has little control over this.Read more","I Wanted a Dedicated E-Reader, and That's What I Got"
,"UPDATE NOVEMBER 2011:My review is now over a year old, as is the Kindle Keyboard as Amazon calls it now. There are newer models: the basic, cheapie Kindle and the Kindle Touch, and of course the Kindle Fire quasi-tablet.Each of these models is an excellent choice. Whichever one is right for you just depends on your preferences.The 3 e-ink Kindles are Kindle Keyboard (this one), Kindle Touch (the newest flagship model), and the basic Kindle. All 3 of them have EXACTLY THE SAME 6 DISPLAY, with the same sharp typeface and high contrast that reads like ink on paper with no eyestrain. The Kindle Keyboard is the oldest of these models, and I got one of the first ones when they came out in August 2010.I still absolutely LOVE my Kindle Keyboard and use it almost every day. I have read dozens of books on it. I like the newer models, they have some neat features, but the experience of reading a book on them is no better or worse than on my 1-year-old Kindle Keyboard. Page turns are now smoother and faster on the newest Kindles, but the difference is not enough to make it worth the cost of upgrading, in my opinion.The touch-screen interface of the Kindle Touch is pretty neat. But, unlike my iPad, I only use my Kindle to read books, and reading books is just as nice on any of the current Kindle models. I don't consider the touch screen a must have feature, and I'm normally obsessed with having the latest version of every tech product I own.For that reason, I think the cheapest Kindle is an excellent choice.Read more",Kindle vs. Nook (updated)
,"I'm a first-time Kindle owner, so I have nothing to compare the latest Kindle to. I don't own a Nook. I don't own an iPad (and, in any case, that's comparing apples to oranges). I don't have a Sony e-reader. 'This will be a short, simple review.I received my Kindle about a week ago and haven't been able to put it down.Things I like about my Kindle1. The e-ink display is amazing.2. Using the 5-way controller is simple and effective.3. Page turn speeds are faster than I thought they would be.4. It's lightweight, even with the attached cover (I have an Amazon cover with a built-in light)5. Page-turning buttons are quiet and well-placed.6. Recharge time is fast.7. I can order a book and start reading it in less than 60 seconds. Nice!8. Portability... I can take 3,000 books with me when I travel for work and not require additional suitcases or baggage fees.Things I'm not too keen on1. Buttons are too close together and are laid out oddly.2. Lack of individual number buttons is frustrating.3. Power button on the bottom Not a bad thing. Just an odd thing. (Same for the headphone input). I usually rest the bottom of a book on my lap when I read.Things I hope change in the future1. How books are organized... When I put a book in a collection (which is actually a tag), it still appears in the main list. It's not actually moved, it's merely associated.2. The look of the main screen. I'd like folders or some other way to display collections.3. Ability to create personal screen savers.4. E-book pricing, though Amazon has little control over this. Still, most titles are the same price as or less than their hardback/paperback counterparts.Read more","I Wanted a Dedicated E-Reader, and That's What I Got"
,"I woke up to a nice surprise this morning: a new kindle as a gift. I have an iPad and a Kindle DX, but I guess someone heard my complaints of them being too heavy and difficult to do extended-reading on. Don't get me wrong, I absolutely love my iPad and DX, but this new generation of Kindle is perfect for reading outside and for long periods of time. The iPad gets completely washed out in sunlight and often irritates my eyes staring at it for more than a couple of hours. The DX was my go-to device for those extended/outdoor reading periods, but now I have a new friend for reading novels. Instead of a replacement, this one seems more like a companion to the other devices and is a different class. The iPad works great for web browsing, shopping, productivity, games, etc while the Kindle falls short in those areas. The Kindle works great for reading novels, where the iPad falls short. For those that love to do extended-reading of magazines, newspapers, research articles, etc, I find that the DX is the go-to device.Without a doubt, the size and weight of the new kindle is the biggest draw for me. It's smaller than the last edition by a significant margin. I've played around with the Kindle 2 and was impressed, but now looking at the size of the new Kindle, I'm blown away. It's the absolute perfect size. Smaller would be unmanageable and larger wouldn't feel nearly as good. This is a device that you can hold up, read, and just forget that it's there. Compared to other e-readers I've tried, it's much smaller and much lighter.One of my biggest complaints about the previous generation Kindles and the DX is the speed. It sometimes takes a while after you push next page' for it to actually change.Read more","Not the perfect do-it-all device, but very close to being the perfect e-reading device!"
,"The Kindle is my first e-ink reader. I own an iPad, an iPhone, and have owned a Windows-based phone in the past that I used as an ereader.br /br /My overall impression of the device is good.br /br /The good:br /I'd honestly rather read linear (read from page one to the end, one page at a time) fiction from it than a book, because I can't always get comfortable with a book. Hardcovers are sometimes a bit heavy, and paperbacks don't always lie open easily. The Kindle is incredibly light and thin. I can hold it in one hand easily. The page turn buttons are conveniently located. Page-turns aren't instant, but they're probably quicker than turning a physical page in a printed book (there are just a lot more page-turns unless you choose a small font). The contrast is better than other ereaders I've seen. There is zero eye strain in good light. My eyesight isn't the greatest and I like being able to increase the font size and read without glasses. I love being able to browse the Kindle store and read samples before deciding to purchase. The experimental browser is surprisingly usable, but isn't great. It is useful for browsing wikipedia and blogs. The biggest drawback to the browser is the awkward pointer navigation, using the 5-way pad. It syncs your furthest read page over the internet so you can pick up where you left off using your iPhone or iPad.br /br /The so-so:br /The kindle store could use more categories and sorting options. You can't sort by top rated, and there is no category for alternate histories, for example. Finding a very-specific type of fiction relies on keyword searches, which don't do a great job. The wifi sometimes doesn't connect before it times-out.Read more","Worth the money. Not perfect, but very very good for start to finish novels in good light"
,"UPDATE NOVEMBER 2011:br /br /My review is now over a year old, as is the Kindle Keyboard as Amazon calls it now. There are newer models: the basic, cheapie Kindle and the Kindle Touch, and of course the Kindle Fire quasi-tablet.br /br /Each of these models is an excellent choice. Whichever one is right for you just depends on your preferences.br /br /The 3 e-ink Kindles are Kindle Keyboard (this one), Kindle Touch (the newest flagship model), and the basic Kindle. All 3 of them have EXACTLY THE SAME 6 DISPLAY, with the same sharp typeface and high contrast that reads like ink on paper with no eyestrain. The Kindle Keyboard is the oldest of these models, and I got one of the first ones when they came out in August 2010.br /br /I still absolutely LOVE my Kindle Keyboard and use it almost every day. I have read dozens of books on it. I like the newer models, they have some neat features, but the experience of reading a book on them is no better or worse than on my 1-year-old Kindle Keyboard. Page turns are now smoother and faster on the newest Kindles, but the difference is not enough to make it worth the cost of upgrading, in my opinion.br /br /The touch-screen interface of the Kindle Touch is pretty neat. But, unlike my iPad, I only use my Kindle to read books, and reading books is just as nice on any of the current Kindle models. I don't consider the touch screen a must have feature, and I'm normally obsessed with having the latest version of every tech product I own.br /br /For that reason, I think the cheapest Kindle is an excellent choice.Read more",Kindle vs. Nook (updated)
,"I woke up to a nice surprise this morning: a new kindle as a gift. I have an iPad and a Kindle DX, but I guess someone heard my complaints of them being too heavy and difficult to do extended-reading on. Don't get me wrong, I absolutely love my iPad and DX, but this new generation of Kindle is perfect for reading outside and for long periods of time. The iPad gets completely washed out in sunlight and often irritates my eyes staring at it for more than a couple of hours. The DX was my go-to device for those extended/outdoor reading periods, but now I have a new friend for reading novels. Instead of a replacement, this one seems more like a companion to the other devices and is a different class. The iPad works great for web browsing, shopping, productivity, games, etc while the Kindle falls short in those areas. The Kindle works great for reading novels, where the iPad falls short. For those that love to do extended-reading of magazines, newspapers, research articles, etc, I find that the DX is the go-to device.br /br /Without a doubt, the size and weight of the new kindle is the biggest draw for me. It's smaller than the last edition by a significant margin. I've played around with the Kindle 2 and was impressed, but now looking at the size of the new Kindle, I'm blown away. It's the absolute perfect size. Smaller would be unmanageable and larger wouldn't feel nearly as good. This is a device that you can hold up, read, and just forget that it's there. Compared to other e-readers I've tried, it's much smaller and much lighter.br /br /One of my biggest complaints about the previous generation Kindles and the DX is the speed. It sometimes takes a while after you push next page' for it to actually change.Read more","Not the perfect do-it-all device, but very close to being the perfect e-reading device!"
,I use to hate to read but now that I have my Kindle and I can change the size of the font so this old lady can see the words better I love to read.,Great
,"All of them quit working. There's absolutely no way to revive them once that battery loses power If NOT charged immediately, if even just a few weeks go by, NO HOPE of ever using your Kindle again. A major flaw",I've had 3!
,"I recently ordered my 8th Kindle. It was to replace my 7th Kindle which I unknowingly crushed. I love the Kindle Keyboard as my clumsy old hands tremble too much to type on a touch screen. For me, newer is just more frustrating. However, new Keyboard Kindles are scarce on the ground, so I got a reconditioned one. I noticed on my account page that Amazon recognized my new Kindle as soon as I bought it. When it arrived, however, it was not registered to me and it claimed it could not connect to my home WiFi. So I called my internet provider. I waded through that companys automated menu beginning with press 1 for English. That irritates me as I think English should be the default language in this country. But pressing on, I provided my 9 digit phone number, my 10 digit account number, my 9 digit zip code, my address, my 8 digit birthday, and the name of my favorite pet, my first car and my oldest nephew. Then I listened to an automated menu that had a 9 item selection none of which exactly fitted the problem I was having. After all this, I was asked if I would provide feedback after the call. I know this company and I was sure I would have comments to make, so I pressed 1 for yes. Then instead of finally letting me speak to a person, the automated voice directed me back through the forest of numbers I had already provided. Patiently I retyped all I had already typed. This time I was cannier. I refused the opportunity to give feedback and was finally connected to a person a person with a strong foreign accent and a bad phone connection. Didnt I press 1 for English After struggling for several minutes I begged for a supervisor as I could not understand the English spoken by this person. I was eventually routed to three other people with a hold time between each new connection as each person I spoke to did not handle my problem. I asked for phone numbers every time so I could reconnect if my call was disconnected accidentally. Finally I found a person who could help and did indeed get a connection established between my Kindle and my WiFi. I again asked for a telephone number in case I had further problems. Im sorry. I do not have a phone number that you can call to connect directly to me. Well, I should have known. I had been on the phone for 50 minutes.Then my Kindle would not download my archived items. So I contacted Amazons Help Line. I got an American in the first minute. I did not have to press anything I explained my problem. The Amazon American fiddled with a few buttons on his end and my Kindle began working correctly. I was on the phone for 4 minutes.",Kindle Customer Service vs. Comcast
,Great. Love it.,I love it
